{
  "agent_id": "02_scope_ontology_resolver",
  "schema_version": "1.0.0",
  "created_at": "2026-06-21T02:02:36Z",
  "provenance": [
    {
      "source_type": "mock",
      "source_id": "02_scope_ontology_resolver",
      "note": "Deterministic mock output for pipeline testing; not a verified public accession."
    }
  ],
  "warnings": [],
  "blocking_failures": [],
  "claim_ceiling": {
    "max_allowed_claim": "co_expression",
    "reason": "Ontology resolution does not increase the claim ceiling."
  },
  "normalized_question_ref": "01_scientific_question_normalizer",
  "disease_candidates": [
    "type 2 diabetes mellitus",
    "diabetes mellitus",
    "insulin resistance"
  ],
  "tissue_candidates": [
    "adipose tissue",
    "subcutaneous adipose tissue",
    "visceral adipose tissue"
  ],
  "species_scope": [
    "human priority",
    "mouse fallback for localization only"
  ],
  "population_scope": [
    "adult metabolic disease cohorts",
    "case-control adipose tissue studies"
  ],
  "cell_type_candidates": [
    "adipocyte",
    "macrophage",
    "stromal vascular fraction cell",
    "endothelial cell"
  ],
  "molecular_entity_types": [
    "secreted protein",
    "cell surface protein",
    "plasma membrane protein",
    "extracellular region annotated protein"
  ],
  "biological_program_terms": [
    "inflammatory response",
    "TNF signaling",
    "IL-6 signaling",
    "NF-kB signaling"
  ],
  "gene_set_candidates": [
    "hallmark_inflammatory_response",
    "tnfa_signaling_via_nfkb",
    "il6_jak_stat3_signaling"
  ],
  "synonyms": [
    "T2D",
    "type II diabetes",
    "fat tissue",
    "adipose depot",
    "secretome",
    "surfaceome"
  ],
  "excluded_expansions": [
    "type 1 diabetes mellitus as the primary disease scope",
    "liver tissue expansion",
    "causal target-discovery framing"
  ],
  "search_query_terms": [
    "type 2 diabetes adipose inflammatory response secreted molecule",
    "type 2 diabetes adipose surface protein inflammatory program",
    "adipose tissue inflammation secretome T2D"
  ],
  "ambiguity_report": [
    "The adipose depot is not specified, so subcutaneous and visceral remain candidates.",
    "Surface and secreted constraints are search filters, not validated accessibility claims."
  ],
  "recommended_scope": {
    "disease": "type 2 diabetes mellitus",
    "tissue": "adipose tissue",
    "species": "human_priority_with_mouse_fallback",
    "molecular_constraint": "secreted_or_surface"
  }
}
